{
  "family": "leviathanrex",
  "base": "greatwhite_cy",
  "rows": [
    {
      "id": "leviathanrex"
    }
  ],
  "budget": {
    "tris": 9000,
    "glb_bytes": 1048576,
    "texture_bytes": 184320
  },
  "mouth": {
    "style": "underbite",
    "gape_degrees": 25,
    "teeth": "upper_lower"
  },
  "head": {
    "mode": "bulbous",
    "scale": 1.15
  },
  "fins": {},
  "accessories": [
    {
      "kit": "plate_row.glb",
      "placement": "dorsal",
      "fused": true
    }
  ],
  "paint": {
    "resolution": 384,
    "species_hsv": [
      0.3,
      0.16,
      0.24
    ],
    "belly": "#93a2a8",
    "softness": 0.18,
    "keep_photo": true,
    "glow_seams": {
      "width": 0.012,
      "colour": "#7fd0e8",
      "strength": 0.18
    }
  },
  "variants": [],
  "turntable": {
    "resolution": 512,
    "texture_resolution": 384,
    "lens": 54,
    "close_lens": 70
  }
}